{
  "$schema": "https://json-schema.org/draft/2020-12/schema",
  "title": "brief",
  "type": "object",
  "properties": {
    "schema_version": {
      "const": "1.0"
    },
    "name": {
      "type": "string",
      "minLength": 1
    },
    "offer": {
      "type": "object",
      "properties": {
        "summary": {
          "type": "string",
          "minLength": 1
        },
        "proof_points": {
          "type": "array",
          "items": {
            "type": "string",
            "minLength": 1
          }
        }
      },
      "required": [],
      "additionalProperties": false
    },
    "sender": {
      "type": "object",
      "properties": {
        "name": {
          "type": "string",
          "minLength": 1
        },
        "company": {
          "type": "string",
          "minLength": 1
        }
      },
      "required": [],
      "additionalProperties": false
    },
    "required": {
      "type": "array",
      "minItems": 1,
      "items": {
        "type": "object",
        "properties": {
          "id": {
            "type": "string",
            "pattern": "^[a-z][a-z0-9-]*$"
          },
          "field": {
            "enum": [
              "contact_id",
              "first_name",
              "email",
              "company",
              "domain",
              "industry",
              "employees",
              "country",
              "role"
            ]
          },
          "op": {
            "enum": [
              "equals",
              "in",
              "range"
            ]
          },
          "value": {}
        },
        "required": [
          "id",
          "field",
          "op",
          "value"
        ],
        "additionalProperties": false,
        "allOf": [
          {
            "if": {
              "properties": {
                "field": {
                  "const": "employees"
                }
              }
            },
            "then": {
              "properties": {
                "value": {
                  "oneOf": [
                    {
                      "type": "integer",
                      "minimum": 0
                    },
                    {
                      "type": "array",
                      "minItems": 1,
                      "items": {
                        "type": "integer",
                        "minimum": 0
                      }
                    }
                  ]
                }
              }
            },
            "else": {
              "properties": {
                "value": {
                  "oneOf": [
                    {
                      "type": "string",
                      "minLength": 1
                    },
                    {
                      "type": "array",
                      "minItems": 1,
                      "items": {
                        "type": "string",
                        "minLength": 1
                      }
                    }
                  ]
                }
              }
            }
          },
          {
            "if": {
              "properties": {
                "op": {
                  "const": "range"
                }
              }
            },
            "then": {
              "properties": {
                "field": {
                  "const": "employees"
                },
                "value": {
                  "type": "array",
                  "minItems": 2,
                  "maxItems": 2,
                  "items": {
                    "type": "integer",
                    "minimum": 0
                  }
                }
              }
            }
          },
          {
            "if": {
              "properties": {
                "op": {
                  "const": "in"
                }
              }
            },
            "then": {
              "properties": {
                "value": {
                  "type": "array",
                  "minItems": 1
                }
              }
            }
          },
          {
            "if": {
              "properties": {
                "op": {
                  "const": "equals"
                }
              }
            },
            "then": {
              "properties": {
                "value": {
                  "type": [
                    "string",
                    "integer"
                  ]
                }
              }
            }
          }
        ]
      }
    },
    "preferences": {
      "type": "array",
      "items": {
        "type": "object",
        "properties": {
          "id": {
            "type": "string",
            "pattern": "^[a-z][a-z0-9-]*$"
          },
          "field": {
            "enum": [
              "contact_id",
              "first_name",
              "email",
              "company",
              "domain",
              "industry",
              "employees",
              "country",
              "role"
            ]
          },
          "op": {
            "enum": [
              "equals",
              "in",
              "range"
            ]
          },
          "value": {}
        },
        "required": [
          "id",
          "field",
          "op",
          "value"
        ],
        "additionalProperties": false,
        "allOf": [
          {
            "if": {
              "properties": {
                "field": {
                  "const": "employees"
                }
              }
            },
            "then": {
              "properties": {
                "value": {
                  "oneOf": [
                    {
                      "type": "integer",
                      "minimum": 0
                    },
                    {
                      "type": "array",
                      "minItems": 1,
                      "items": {
                        "type": "integer",
                        "minimum": 0
                      }
                    }
                  ]
                }
              }
            },
            "else": {
              "properties": {
                "value": {
                  "oneOf": [
                    {
                      "type": "string",
                      "minLength": 1
                    },
                    {
                      "type": "array",
                      "minItems": 1,
                      "items": {
                        "type": "string",
                        "minLength": 1
                      }
                    }
                  ]
                }
              }
            }
          },
          {
            "if": {
              "properties": {
                "op": {
                  "const": "range"
                }
              }
            },
            "then": {
              "properties": {
                "field": {
                  "const": "employees"
                },
                "value": {
                  "type": "array",
                  "minItems": 2,
                  "maxItems": 2,
                  "items": {
                    "type": "integer",
                    "minimum": 0
                  }
                }
              }
            }
          },
          {
            "if": {
              "properties": {
                "op": {
                  "const": "in"
                }
              }
            },
            "then": {
              "properties": {
                "value": {
                  "type": "array",
                  "minItems": 1
                }
              }
            }
          },
          {
            "if": {
              "properties": {
                "op": {
                  "const": "equals"
                }
              }
            },
            "then": {
              "properties": {
                "value": {
                  "type": [
                    "string",
                    "integer"
                  ]
                }
              }
            }
          }
        ]
      }
    },
    "exclusions": {
      "type": "array",
      "items": {
        "type": "object",
        "properties": {
          "id": {
            "type": "string",
            "pattern": "^[a-z][a-z0-9-]*$"
          },
          "field": {
            "enum": [
              "contact_id",
              "first_name",
              "email",
              "company",
              "domain",
              "industry",
              "employees",
              "country",
              "role"
            ]
          },
          "op": {
            "enum": [
              "equals",
              "in",
              "range"
            ]
          },
          "value": {}
        },
        "required": [
          "id",
          "field",
          "op",
          "value"
        ],
        "additionalProperties": false,
        "allOf": [
          {
            "if": {
              "properties": {
                "field": {
                  "const": "employees"
                }
              }
            },
            "then": {
              "properties": {
                "value": {
                  "oneOf": [
                    {
                      "type": "integer",
                      "minimum": 0
                    },
                    {
                      "type": "array",
                      "minItems": 1,
                      "items": {
                        "type": "integer",
                        "minimum": 0
                      }
                    }
                  ]
                }
              }
            },
            "else": {
              "properties": {
                "value": {
                  "oneOf": [
                    {
                      "type": "string",
                      "minLength": 1
                    },
                    {
                      "type": "array",
                      "minItems": 1,
                      "items": {
                        "type": "string",
                        "minLength": 1
                      }
                    }
                  ]
                }
              }
            }
          },
          {
            "if": {
              "properties": {
                "op": {
                  "const": "range"
                }
              }
            },
            "then": {
              "properties": {
                "field": {
                  "const": "employees"
                },
                "value": {
                  "type": "array",
                  "minItems": 2,
                  "maxItems": 2,
                  "items": {
                    "type": "integer",
                    "minimum": 0
                  }
                }
              }
            }
          },
          {
            "if": {
              "properties": {
                "op": {
                  "const": "in"
                }
              }
            },
            "then": {
              "properties": {
                "value": {
                  "type": "array",
                  "minItems": 1
                }
              }
            }
          },
          {
            "if": {
              "properties": {
                "op": {
                  "const": "equals"
                }
              }
            },
            "then": {
              "properties": {
                "value": {
                  "type": [
                    "string",
                    "integer"
                  ]
                }
              }
            }
          }
        ]
      }
    },
    "column_map": {
      "type": "object",
      "properties": {
        "contact_id": {
          "type": "string",
          "minLength": 1
        },
        "first_name": {
          "type": "string",
          "minLength": 1
        },
        "email": {
          "type": "string",
          "minLength": 1
        },
        "company": {
          "type": "string",
          "minLength": 1
        },
        "domain": {
          "type": "string",
          "minLength": 1
        },
        "industry": {
          "type": "string",
          "minLength": 1
        },
        "employees": {
          "type": "string",
          "minLength": 1
        },
        "country": {
          "type": "string",
          "minLength": 1
        },
        "role": {
          "type": "string",
          "minLength": 1
        },
        "source_ref": {
          "type": "string",
          "minLength": 1
        },
        "observed_at": {
          "type": "string",
          "minLength": 1
        }
      },
      "required": [],
      "additionalProperties": false
    },
    "signal_types": {
      "type": "array",
      "items": {
        "type": "string",
        "minLength": 1
      }
    },
    "signal_max_age_days": {
      "type": "integer",
      "minimum": 0
    },
    "evidence_max_age_days": {
      "type": "integer",
      "minimum": 0
    },
    "templates": {
      "type": "object",
      "properties": {
        "subject": {
          "type": "string",
          "minLength": 1
        },
        "first": {
          "type": "string",
          "minLength": 1
        },
        "follow_up": {
          "type": "string",
          "minLength": 1
        }
      },
      "required": [],
      "additionalProperties": false
    }
  },
  "required": [
    "schema_version",
    "name",
    "required"
  ],
  "additionalProperties": false
}
